english,french,spanish,german
"The sun sets behind the mountains, casting a golden hue.",,,
A gentle breeze rustled the leaves of the old oak tree.,,,
"Children laughed as they played in the park, their voices echoing.",,,
The baker kneaded the dough with practiced hands.,,,
"An old photograph lay forgotten in the attic, covered in dust.",,,
"She sipped her coffee slowly, savoring the warmth.",,,
The dog barked excitedly at the sight of the squirrel.,,,
"A melody played softly in the background, calming the room.",,,
"He wrote in his journal, documenting his travels.",,,
The rain tapped lightly against the windowpane.,,,
"A cat curled up on the windowsill, watching the world outside.",,,
"She painted the sunset in vibrant colors, capturing its beauty.",,,
"The library was quiet, filled with the scent of old books.",,,
"He strolled along the beach, the waves lapping at his feet.",,,
A single candle flickered in the dark room.,,,
The snow covered the landscape in a pristine white blanket.,,,
She read the letter with tears in her eyes.,,,
The clock ticked away the seconds in the silent room.,,,
He planted a garden filled with colorful flowers.,,,
The musician tuned his guitar before the performance.,,,
"A butterfly fluttered by, its wings a blur of color.",,,
"She danced in the rain, her laughter echoing.",,,
The chef prepared a feast fit for a king.,,,
"A train whistled in the distance, its sound growing faint.",,,
The artist sketched the city skyline from memory.,,,
"A ship sailed on the horizon, its sails billowing.",,,
The wind chimes tinkled softly in the breeze.,,,
She discovered a hidden path in the forest.,,,
The fire crackled warmly in the hearth.,,,
A rainbow arched across the sky after the storm.,,,
He whistled a tune as he worked in the garden.,,,
The scent of fresh bread filled the kitchen.,,,
She organized her bookshelf by color and size.,,,
A bird sang a cheerful song from the treetop.,,,
He watched the stars twinkle in the night sky.,,,
"The river flowed steadily, its waters clear and cool.",,,
She knitted a scarf for her granddaughter.,,,
A lighthouse stood tall on the rocky shore.,,,
The bicycle wheels spun as he pedaled down the street.,,,
She baked cookies for the neighborhood children.,,,
The treehouse was their secret hideaway.,,,
He framed the photograph and hung it on the wall.,,,
"A fox darted through the underbrush, quick and silent.",,,
She collected seashells along the shore.,,,
The train station was bustling with travelers.,,,
He brewed a pot of tea and set the table.,,,
A crow cawed loudly from the rooftop.,,,
"She wrapped the gift with care, tying a bow on top.",,,
The clock tower chimed the hour.,,,
He wrote a letter to his old friend.,,,
The campfire crackled as they roasted marshmallows.,,,
"A kite soared high in the sky, dancing with the wind.",,,
"She planted tulips in the garden, their colors bright.",,,
The fisherman cast his line into the calm lake.,,,
A lantern glowed softly on the porch.,,,
She arranged a bouquet of wildflowers in a vase.,,,
The mountain trail was steep but rewarding.,,,
He polished his shoes until they shone.,,,
A frog leaped from lily pad to lily pad.,,,
"She braided her hair, tying it with a ribbon.",,,
"The wind picked up, rustling the autumn leaves.",,,
He carved a pumpkin for Halloween.,,,
A squirrel gathered acorns for the winter.,,,
She folded the laundry neatly into piles.,,,
The sunflowers turned to face the rising sun.,,,
"He strummed the guitar, the chords echoing.",,,
A wave crashed against the rocky shore.,,,
"She baked a pie, the aroma filling the house.",,,
The horse galloped across the open field.,,,
He built a sandcastle on the beach.,,,
A deer grazed quietly in the meadow.,,,
She painted her nails a bright shade of red.,,,
The coffee shop buzzed with conversation.,,,
He hung the new curtains in the living room.,,,
"A robin perched on the fence, singing sweetly.",,,
She sorted through old photographs in the album.,,,
The orchestra played a symphony of sound.,,,
"He tended to his garden, pulling weeds and watering plants.",,,
A cat chased a mouse through the tall grass.,,,
She knitted a warm blanket for winter.,,,
"The fog rolled in, covering the city in mist.",,,
He built a model airplane from a kit.,,,
A butterfly landed on the tip of her finger.,,,
She hummed a tune as she washed the dishes.,,,
The stars twinkled in the clear night sky.,,,
"He read a book by the fire, the pages turning slowly.",,,
A snail inched its way across the garden path.,,,
She planted a row of tomatoes in the garden.,,,
"The wind howled through the trees, bending their branches.",,,
He hung the birdhouse in the old oak tree.,,,
A cricket chirped somewhere in the darkness.,,,
She lit a candle and placed it on the windowsill.,,,
"The train rumbled down the tracks, its whistle echoing.",,,
He tied his shoes and went for a run.,,,
A dragonfly hovered above the pond.,,,
She hung the laundry out to dry in the sun.,,,
The moonlight reflected off the calm ocean.,,,
He built a fire in the stone fireplace.,,,
"A horse neighed in the distance, breaking the silence.",,,
"She iced the cake with smooth, even strokes.",,,
The sunflower field stretched out as far as the eye could see.,,,
He whistled a cheerful tune as he worked.,,,
A spider spun its web in the corner of the room.,,,
She dipped the brush into the paint and began to create.,,,
The dog wagged its tail happily at the sight of its owner.,,,
He filled the bird feeder with seeds.,,,
A turtle basked in the sun on a rock.,,,
She wrote a poem about the changing seasons.,,,
The leaves crunched underfoot as they walked through the woods.,,,
"He played a melody on the piano, the notes filling the room.",,,
"A bee buzzed from flower to flower, collecting nectar.",,,
She sewed a patch onto her favorite jeans.,,,
The waterfall cascaded down the rocks with a roar.,,,
"He repaired the old clock, carefully placing each gear.",,,
"A candle flickered on the windowsill, casting a soft glow.",,,
"She braided her daughter's hair, tying it with a ribbon.",,,
The cat purred contentedly on her lap.,,,
He poured a glass of lemonade on a hot summer day.,,,
"A deer wandered into the garden, nibbling on the flowers.",,,
"She organized her desk, placing each item in its proper place.",,,
The rooster crowed at the break of dawn.,,,
"He hung the picture frame on the wall, stepping back to admire it.",,,
A bat flew silently through the night sky.,,,
She picked fresh strawberries from the garden.,,,
The windmill turned slowly in the breeze.,,,
He stacked the firewood neatly by the door.,,,
A bluebird sang a song of spring.,,,
"She arranged the flowers in a vase, their colors vibrant.",,,
The kitten played with a ball of yarn on the floor.,,,
He polished the silverware until it gleamed.,,,
"A rabbit darted across the field, disappearing into the bushes.",,,
She wrapped the scarf around her neck as the wind blew.,,,
The sunrise painted the sky in shades of pink and orange.,,,
"He repaired the bicycle, tightening the loose screws.",,,
"A peacock strutted through the garden, its feathers fanned out.",,,
"She stirred the soup, tasting it to check the seasoning.",,,
"The snowflakes fell gently, covering the ground in a soft blanket.",,,
"He tied the fishing line to the hook, preparing his gear.",,,
A woodpecker tapped rhythmically on the tree trunk.,,,
She placed the cookies on the cooling rack.,,,
"The waves lapped against the shore, a constant rhythm.",,,
He pruned the rose bushes in the garden.,,,
"A hawk circled high above, searching for prey.",,,
"She dusted the shelves, humming a tune.",,,
The creek babbled softly as it wound through the forest.,,,
He hung the wind chimes on the porch.,,,
"A dolphin leaped out of the water, splashing back down.",,,
She placed a bookmark in the novel and set it aside.,,,
The goat nibbled on the grass by the fence.,,,
"He lit the fireplace, warming the chilly room.",,,
A pelican glided gracefully over the water.,,,
She baked a batch of chocolate chip cookies.,,,
"The fireflies danced in the twilight, their lights flickering.",,,
He harvested the ripe apples from the orchard.,,,
A seagull called out as it soared above the ocean.,,,
She stitched a quilt from scraps of old fabric.,,,
"The river glistened in the sunlight, flowing steadily.",,,
He carved his initials into the tree trunk.,,,
A dragonfly zipped across the surface of the pond.,,,
She brewed a cup of tea and sat by the window.,,,
"The eagle soared high above the mountains, its wings outstretched.",,,
"He trimmed the hedges, shaping them neatly.",,,
A fox trotted along the edge of the forest.,,,
She placed a fresh loaf of bread on the table.,,,
The boat rocked gently on the waves.,,,
He planted a row of carrots in the garden.,,,
"A butterfly rested on a flower, its wings slowly opening and closing.",,,
She tied her shoelaces and went for a walk.,,,
The scent of pine filled the air as they hiked through the forest.,,,
He whittled a small figure from a piece of wood.,,,
"A squirrel scurried up the tree trunk, chattering.",,,
She folded the napkins and placed them on the table.,,,
"The lake was calm, reflecting the sky above.",,,
He built a birdhouse and hung it in the garden.,,,
"A heron stood silently by the water's edge, watching.",,,
She planted a row of daffodils along the path.,,,
"The barn was quiet, the animals settled for the night.",,,
He brewed a pot of coffee as the sun rose.,,,
